OrderNumber,CustomerName,State,TaxRate,ProductType,Area,CostPerSquareFoot,LaborCostPerSquareFoot,MaterialCost,LaborCost,Tax,Total, Last Revised
25886,"Darkzealot, Dawn",The Pirate's Pipe,16.94,Tin Of The Tundra,354.00,4121.00,397.25,1458834.0000,140626.5000,1870409.10870000,07/30/2018 @ 12:00:00 AM
11462,Deathbrood,The Fortress of Asmamur,-2.42,Swordbronze,392.00,333.30,303.00,130653.6000,118776.0000,243393.40368000,07/30/2018 @ 12:00:00 AM
24825,Deathbrood,Bifar's Deep,12.21,Foul Ice Bronze Of Life,365.00,292.82,266.20,106879.3000,97163.0000,228955.86483000,07/30/2018 @ 12:00:00 AM
11961,"Ivycaster, Fate",Love Keep,40.56,Foul Ice Bronze Of Life,195.00,292.82,266.20,57099.9000,51909.0000,153222.90984000,07/30/2018 @ 12:00:00 AM
28007,"Rougehate, Rune",The Chuallanto Jungle,11.00,Undeads' Mind Orichalcum Of The Twilight,191.00,1169.00,364.69,223279.0000,69655.7900,325157.61690000,07/30/2018 @ 12:00:00 AM
29452,"God of Resurrection, Gadriel",The Nulukkhath Spires,28.99,Heavenly Dreamsilver Of The Night,136.00,719.00,314.60,97784.0000,42785.6000,181320.72704000,07/30/2018 @ 12:00:00 AM
6312,"The Evil, Flameflare",The Barrow of Terrible Horror,27.39,Fleshshock Mercury,258.00,-31.02,-28.20,-8003.1600,-7275.6000,-19463.61236400,07/30/2018 @ 12:00:00 AM
28318,"Runetomb, Song",Barad Cune,49.21,Negative Rockglitter Mercury Of Trolls,114.00,235.59,214.17,26857.2600,24415.3800,76503.90614400,07/30/2018 @ 12:00:00 AM
5624,"Dawn, Tarot",The Bastion of the Vampire Duke,34.45,Nymphs' Luminous Rotmercury Of The Skies,170.00,335.50,305.00,57035.0000,51850.0000,146395.88250000,07/30/2018 @ 12:00:00 AM
